
00: f1 d0 00 02 00 00 01 a0 00 00 00 00 00 00 00 00      ................
01: 00 00 bf ff 00 00 00 00 ff ff ff ff 00 00 00 00      ................
02: 00 00 00 01 ff ff ff ff ff ff ff ff 27 47 2f bf      ............'G/.
03: 27 47 2f bf 27 47 2f c4 27 47 2f c4 00 05 34 eb      'G/.'G/.'G/...4.
04: ff ff ff ff ff ff ff ff ff ff ff ff 00 05 35 03      ..............5.
05: ff ff ff ff 00 05 34 fb 00 05 28 7b 00 05 34 f3      ......4...({..4.
06: 00 05 35 0b 00 05 34 e3 ff ff ff ff ff ff ff ff      ..5...4.........
07: 00 00 00 00 00 00 b3 e9 00 00 5a f2 00 00 00 00      ..........Z.....
08: f1 d0 00 02 00 00 01 a0 00 00 00 00 00 00 00 00      ................
09: 00 00 df ff 00 00 00 00 ff ff ff ff 00 00 00 00      ................
0a: 00 00 00 01 ff ff ff ff ff ff ff ff 27 43 2a 1e      ............'C*.
0b: 27 47 44 c2 27 47 2f bb 27 47 2f bb ff ff ff ff      'GD.'G/.'G/.....
0c: ff ff ff ff 00 04 73 9c 00 04 73 a4 00 00 3b c3      ......s...s...;.
0d: ff ff ff ff 00 00 3b b3 00 05 27 5c 00 05 27 64      ......;...'\..'d
0e: 00 05 27 6c 00 05 27 4c ff ff ff ff ff ff ff ff      ..'l..'L........
0f: 00 00 00 00 00 00 64 0b 00 00 5a ce 00 00 00 00      ......d...Z.....

00: f1 d0 00 02 00 00 01 a0 00 00 00 00 00 00 00 00      ................
01: 00 00 bf ff 00 00 00 00 ff ff ff ff 00 00 00 00      ................
02: 00 00 00 01 ff ff ff ff ff ff ff ff 27 47 2f bf      ............'G/.
03: 27 47 2f bf 27 47 2f c4 27 47 2f c4 00 05 34 eb      'G/.'G/.'G/...4.
04: ff ff ff ff ff ff ff ff ff ff ff ff 00 05 35 03      ..............5.
05: ff ff ff ff 00 05 34 fb 00 05 28 7b 00 05 34 f3      ......4...({..4.
06: 00 05 35 0b 00 05 34 e3 ff ff ff ff ff ff ff ff      ..5...4.........
07: 00 00 00 00 00 00 b3 ec 00 00 5a f2 00 00 00 00      ..........Z.....
08: f1 d0 00 02 00 00 01 a0 00 00 00 00 00 00 00 00      ................
09: 00 00 df ff 00 00 00 00 ff ff ff ff 00 00 00 00      ................
0a: 00 00 00 01 ff ff ff ff ff ff ff ff 27 43 2a 1e      ............'C*.
0b: 27 47 44 c2 27 47 2f bb 27 47 2f bb ff ff ff ff      'GD.'G/.'G/.....
0c: ff ff ff ff 00 04 73 9c 00 04 73 a4 00 00 3b c3      ......s...s...;.
0d: ff ff ff ff 00 00 3b b3 00 05 27 5c 00 05 27 64      ......;...'\..'d
0e: 00 05 27 6c 00 05 27 4c ff ff ff ff ff ff ff ff      ..'l..'L........
0f: 00 00 00 00 00 00 64 0e 00 00 5a ce 00 00 00 00      ......d...Z.....

$5 = {315632, 352603, -1, -1, -1, 353169, 353177, 477073, -1, -1, -1, -1, 477081, 316109, -1, -1, -1, -1, -1, 336770, 351717, -1, -1, -1, -1, 351749, -1, -1, -1, -1, -1, 170036, -1, -1, -1, -1, -1, 477009, 477113, -1, 315624, -1, -1, 477041, 477193, -1, -1, -1, -1, 477145, 477201, -1, -1, -1, -1, 477057, 477129, -1, -1, -1, -1, 477065, 477161, -1, -1, -1, -1, -1, 352611, -1, -1, -1, -1, -1, 351709, -1, -1, -1, -1, 477089, 477177, -1, -1, -1, -1, -1, 351741, -1, -1, -1, -1, -1, 477097, 477137, -1, -1, -1, -1, 477105, 477185, -1, -1, -1, -1, 213216, 477121, -1, -1, -1, -1, 476953, 477153} 344 697


$8 = {315632, <352603>, -1, -1, -1, 352578, 352586, 477073, -1, -1, -1, -1, 477081, 316109, -1, -1, -1, -1, -1, 336770, 352562, -1, -1, -1, -1, 352554, -1, -1, -1, -1, -1, 170036, -1, -1, -1, -1, -1, 477009, 477113, -1, 315624, -1, -1, 477041, 477193, -1, -1, -1, -1, 477145, 477201, -1, -1, -1, -1, 477057, 477129, -1, -1, -1, -1, 477065, 477161, -1, -1, -1, -1, -1, <352611>, -1, -1, -1, -1, -1, 352594, -1, -1, -1, -1, 477089, 477177, -1, -1, -1, -1, -1, 352570, -1, -1, -1, -1, -1, 477097, 477137, -1, -1, -1, -1, 477105, 477185, -1, -1, -1, -1, 213216, 477121, -1, -1, -1, -1, 476953, 477153}  logend = 344 811

bad 1 68

5 353169 352578      
6 353177 352586
20 351717 352562
25 351749 352554
74 351709 352594
86 351741 352570

